{
  "$schema": "http://json-schema.org/schema#",
  "$schemaVersion": "0.0.1",
  "$id": "https://smart-data-models.github.io/dataModel.EnergyStorage/FuelCell/schema.json,",
  "title": "Fuel cell data model",
  "description": "A generic fuel cell which can generate energy from hydrogen",
  "modelTags": "",
  "derivedFrom": "",
  "required": [
    "id",
    "type"
  ],
  "license": "https://smart-data-models.github.io/dataModel.EnergyStorage/FuelCell/LICENSE.md",
  "type": "object",
  "properties": {
    "id": {
      "type": "string",
      "format": "uri",
      "description": "Property. Unique ID of the object"
    },
    "type": {
      "type": "string",
      "description": "Property. Title of the form element"
    },
    "description": {
      "type": "string",
      "description": "Property. Description of the element"
    },
    "location": {
      "type": "object",
      "description": "GeoProperty. Location",
      "properties": {}
    },
    "status": {
      "type": "string",
      "description": "Property. Status: ON/OFF"
    },
    "name": {
      "type": "string",
      "description": "Property. Name of the object"
    },
    "maxHydrogenFlowConsumed": {
      "type": "number",
      "description": "Property. Maximum hydrogen flow consumed (Nl/h)"
    },
    "maxPowerGenerated": {
      "type": "number",
      "description": "Property. Maximum power produced (W)"
    }
  }
}